regime,N,support_level,dominant_routing,drift_behavior,claim_strength
Modifier/penetrance boundary,16125,strong_empirical_support,population/penetrance review; PRF-needed,population/penetrance review; PRF-needed,Modifier/penetrance-boundary architecture is strongly supported as a portability regime requiring population/penetrance review and PRF-style conditional-risk framing.
Nonspecific/underresolved,7253,strong_empirical_support,contextual repair or disease-specific review,contextual repair or disease-specific review,Nonspecific/underresolved architecture is strongly supported as a portability regime requiring contextual repair or disease-specific review.
Structural-functional overlap,2127,strong_empirical_support,domain repair; disease-specific expert review,domain repair; disease-specific expert review,Structural-functional overlap is strongly supported as a cardiac portability regime enriched for disease-specific review.
Phenotype-anchored monogenic,756,strong_empirical_support,direct deterministic use within concordant self-loop,direct deterministic use within concordant self-loop,Phenotype-anchored monogenic assertions are empirically supported as a self-loop-stable portability regime.
Syndrome-organ boundary,408,strong_empirical_support,source_identity_accepted; contextual_repair_or_disease_specific_review,source identity accepted; contextual repair or disease-specific review,Syndrome-organ boundary is supported as an identity-versus-meaning boundary class; its domain-specific enrichment should be stated cautiously.
Trigger-dependent latent,45,underpowered_framework_category,contextual repair; trigger/phenotype-context review,contextual repair; trigger/phenotype-context review,"Trigger-dependent latent architecture is a biologically motivated CAB/PRF framework category and high-priority validation target, but is underpowered here."
Pleiotropic collision,11,underpowered_framework_category,disease-specific review or contextual repair,disease-specific review or contextual repair,Pleiotropic-collision architecture is a biologically motivated framework category but is underpowered here and should not be claimed as robustly driving boundary crossing.
Genotype-first absent phenotype,0,absent_in_current_benchmark,PRF-needed; phenotype ascertainment review; no deterministic reuse,PRF-needed; no deterministic reuse,"Genotype-first absent-phenotype architecture is retained as a PRF-relevant conceptual regime, not empirically supported in the current mapping."
