claim_text,N,numerator,denominator,percent,model_or_statistic,CI,p_or_FDR,source_file,script,claim_strength
Cardiomyopathy P/LP assertions showed condition-label meaning drift despite stable classification.,4918,1901,4918,38.65,endpoint_count; baseline_regime_only_AUROC=0.7024,0.6861-0.7157,,reports/tables/cardiomyopathy_temporal_endpoint_counts_v2.csv; reports/tables/cardiomyopathy_model_comparison_baseline_only.csv,src/run_cardiomyopathy_replication_v2_baseline_only.py,external_domain_replication
Cardiomyopathy P/LP assertions showed broad assertion meaning drift.,4918,1985,4918,40.36,endpoint_count; baseline_regime_only_AUROC=0.6951,0.6791-0.7094,,reports/tables/cardiomyopathy_temporal_endpoint_counts_v2.csv; reports/tables/cardiomyopathy_model_comparison_baseline_only.csv,src/run_cardiomyopathy_replication_v2_baseline_only.py,external_domain_replication
Cardiomyopathy P/LP assertions showed cross-environment meaning drift.,4918,485,4918,9.86,endpoint_count; baseline_regime_only_AUROC=0.7713,0.7555-0.7876,,reports/tables/cardiomyopathy_temporal_endpoint_counts_v2.csv; reports/tables/cardiomyopathy_model_comparison_baseline_only.csv,src/run_cardiomyopathy_replication_v2_baseline_only.py,descriptive_replication
Baseline-only CAB-like regimes stratified condition-label drift if gene+regime improves over gene-only.,4918,,4918,,gene_only_AUROC=0.6556; baseline_regime_AUROC=0.7024; gene_plus_regime_AUROC=0.7277,,,reports/tables/cardiomyopathy_model_comparison_baseline_only.csv,src/run_cardiomyopathy_replication_v2_baseline_only.py,baseline_only_predictive_support
Baseline-only CAB-like regimes stratified cross-environment drift if leakage-clean signal remains.,4918,485,4918,9.86,baseline_regime_only_AUROC=0.7713; baseline_collision_enrichment_OR=0.1870364302523011,,p=0.9999999999999957; FDR=1.0,reports/tables/cardiomyopathy_model_comparison_baseline_only.csv; reports/tables/cardiomyopathy_transition_enrichment_tests_baseline_only.csv,src/run_cardiomyopathy_replication_v2_baseline_only.py,baseline_only_predictive_support
CMP VCEP/CSpec coverage is gene-level only; no variant-level ClinGen Evidence Repository validation was joined.,4918,1135,4918,23.08,gene-level scope only,,,reports/tables/cardiomyopathy_clingen_overlay_status_clean.csv,src/run_cardiomyopathy_replication_v2_baseline_only.py,gene_level_external_constraint_only
Previous cardiomyopathy cross-environment AUROC=0.9742 is blocked because v1 regimes used follow-up environments.,4918,,,,blocked prior metric,,,reports/tables/cardiomyopathy_regime_leakage_audit.csv,src/run_cardiomyopathy_replication_v2_baseline_only.py,blocked_by_leakage
