"claim","supporting_N","effect_size","OR_AUROC_or_rate","domains","support_level","limitation"
"Anchored architectures self-stabilize","756","self-loop enrichment","2.7608819543729073","cardiomyopathy","strong_empirical_support","self-loop stability does not imply cross-boundary portability"
"Modifier/penetrance-boundary dominates non-portable space","16125","population/penetrance review enrichment","39870.6856871638","hereditary_cancer","strong_empirical_support","does not validate penetrance estimates or outcomes"
"Nonspecific/underresolved states require contextual repair","7253","contextual repair / condition-label drift enrichment","3.067039711282192","cardiomyopathy|hereditary_cancer|inherited_arrhythmia","strong_empirical_support","requires expert label-resolution review for validation"
"Structural-functional overlap requires disease-specific review","2127","disease-specific review enrichment","82.43202259195897","cardiomyopathy|inherited_arrhythmia","strong_empirical_support","does not claim clinical mechanism or patient outcome validation"
"Identity matching does not guarantee meaning matching","304","source match accepted but meaning rejected","meaning_rejected_N=304","inherited_arrhythmia","strong_identity_vs_meaning_support","does not imply ClinVar records are invalid"
"Protein damage does not explain portability","","AlphaMissense/protein comparator rank-AUC where available","not_estimable_in_current_final_table","available matched subset","partial_comparator_support","Protein-level deleteriousness comparator is incomplete or unavailable in the final joined table; do not use as a primary biological claim."
"Classification support does not equal portability","9868","high-support low-portability quadrant exists","high_support_low_portability_N=9868","three-domain benchmark","moderate","classification support remains important; it is just not the same layer as portability"
